2025-11-17 12:18:14,088 - INFO - ======================================================================
2025-11-17 12:18:14,088 - INFO - DataGo Bot vs KataGo Match (Recursive Deep Search + RAG)
2025-11-17 12:18:14,088 - INFO - ======================================================================
2025-11-17 12:18:14,088 - INFO - Games: 1, Max moves per game: 250
2025-11-17 12:18:14,088 - INFO - Deep search threshold: 0.2
2025-11-17 12:18:14,088 - INFO - Max recursion depth: 3
2025-11-17 12:18:14,088 - INFO - Deep MCTS visits: 2000
2025-11-17 12:18:14,088 - INFO - 
2025-11-17 12:18:14,088 - INFO - Starting KataGo GTP on GPU 7...
2025-11-17 12:18:14,088 - INFO - Starting GTP engine: ../KataGo/cpp/katago gtp -model ../KataGo/models/g170e-b10c128-s1141046784-d204142634.bin.gz -config ../KataGo/configs/gtp_800visits.cfg
2025-11-17 12:18:14,089 - INFO - Initializing RAG database with multi-context support...
2025-11-17 12:18:14,089 - INFO - Recursion depth: 3
2025-11-17 12:18:14,089 - INFO - Deep search threshold: 0.150
2025-11-17 12:18:14,089 - INFO - Deep search visits: 2000, Standard visits: 800
2025-11-17 12:18:14,089 - INFO - 
======================================================================
2025-11-17 12:18:14,089 - INFO - Game 1/1
2025-11-17 12:18:14,089 - INFO - ======================================================================

2025-11-17 12:18:15,741 - INFO - Move 1: DataGo (Black) thinking...
2025-11-17 12:18:16,465 - INFO -   → Complex position detected (unc=0.180)
2025-11-17 12:18:16,466 - INFO -   → No match found: fe8837bac731, running deep search
2025-11-17 12:18:16,467 - INFO -   → Deep search (depth=0, unc=0.180)
2025-11-17 12:18:16,696 - INFO -     → Recursive search for child
2025-11-17 12:18:16,697 - INFO -     → Deep search (depth=1, unc=0.552)
2025-11-17 12:18:17,059 - INFO -       → Recursive search for child
2025-11-17 12:18:17,062 - INFO -       → Deep search (depth=2, unc=0.556)
2025-11-17 12:18:17,426 - INFO -         → Recursive search for child
2025-11-17 12:18:17,426 - INFO -         → Max recursion depth reached
2025-11-17 12:18:17,576 - INFO -         → Recursive search for child
2025-11-17 12:18:17,576 - INFO -         → Max recursion depth reached
2025-11-17 12:18:17,688 - INFO -         → Child cache hit: 14f90fd2c712
2025-11-17 12:18:17,689 - INFO -         → Recursive search for child
2025-11-17 12:18:17,689 - INFO -         → Max recursion depth reached
2025-11-17 12:18:17,768 - INFO -         → Recursive search for child
2025-11-17 12:18:17,768 - INFO -         → Max recursion depth reached
2025-11-17 12:18:17,843 - INFO -       → Child cache hit: 14a32067ec1d
2025-11-17 12:18:17,845 - INFO -       → Child cache hit: 14f90fd2c712
2025-11-17 12:18:17,848 - INFO -       → Child cache hit: 14f90fd2c712
2025-11-17 12:18:17,850 - INFO -       → Recursive search for child
2025-11-17 12:18:17,853 - INFO -       → Deep search (depth=2, unc=0.556)
2025-11-17 12:18:18,019 - INFO -         → Recursive search for child
2025-11-17 12:18:18,019 - INFO -         → Max recursion depth reached
2025-11-17 12:18:18,090 - INFO -         → Recursive search for child
2025-11-17 12:18:18,090 - INFO -         → Max recursion depth reached
2025-11-17 12:18:18,159 - INFO -         → Recursive search for child
2025-11-17 12:18:18,159 - INFO -         → Max recursion depth reached
2025-11-17 12:18:18,228 - INFO -         → Recursive search for child
2025-11-17 12:18:18,228 - INFO -         → Max recursion depth reached
2025-11-17 12:18:18,297 - INFO -         → Recursive search for child
2025-11-17 12:18:18,297 - INFO -         → Max recursion depth reached
2025-11-17 12:18:18,364 - INFO -     → Child cache hit: 9cbe904cde37
2025-11-17 12:18:18,366 - INFO -     → Child cache hit: 9cbe904cde37
2025-11-17 12:18:18,369 - INFO -     → Recursive search for child
2025-11-17 12:18:18,371 - INFO -     → Deep search (depth=1, unc=0.552)
2025-11-17 12:18:18,507 - INFO -       → Recursive search for child
2025-11-17 12:18:18,509 - INFO -       → Deep search (depth=2, unc=0.516)
2025-11-17 12:18:18,643 - INFO -         → Recursive search for child
2025-11-17 12:18:18,643 - INFO -         → Max recursion depth reached
2025-11-17 12:18:18,654 - INFO -         → Recursive search for child
2025-11-17 12:18:18,654 - INFO -         → Max recursion depth reached
2025-11-17 12:18:18,665 - INFO -         → Recursive search for child
2025-11-17 12:18:18,665 - INFO -         → Max recursion depth reached
2025-11-17 12:18:18,675 - INFO -         → Recursive search for child
2025-11-17 12:18:18,675 - INFO -         → Max recursion depth reached
2025-11-17 12:18:18,686 - INFO -       → Recursive search for child
2025-11-17 12:18:18,688 - INFO -       → Deep search (depth=2, unc=0.516)
2025-11-17 12:18:18,731 - INFO -         → Recursive search for child
2025-11-17 12:18:18,732 - INFO -         → Max recursion depth reached
2025-11-17 12:18:18,790 - INFO -         → Recursive search for child
2025-11-17 12:18:18,790 - INFO -         → Max recursion depth reached
2025-11-17 12:18:18,812 - INFO -         → Recursive search for child
2025-11-17 12:18:18,812 - INFO -         → Max recursion depth reached
2025-11-17 12:18:18,826 - INFO -         → Recursive search for child
2025-11-17 12:18:18,826 - INFO -         → Max recursion depth reached
2025-11-17 12:18:18,840 - INFO -       → Recursive search for child
2025-11-17 12:18:18,842 - INFO -       → Deep search (depth=2, unc=0.516)
2025-11-17 12:18:18,921 - INFO -         → Recursive search for child
2025-11-17 12:18:18,921 - INFO -         → Max recursion depth reached
2025-11-17 12:18:18,932 - INFO -         → Recursive search for child
2025-11-17 12:18:18,932 - INFO -         → Max recursion depth reached
2025-11-17 12:18:18,942 - INFO -         → Recursive search for child
2025-11-17 12:18:18,942 - INFO -         → Max recursion depth reached
2025-11-17 12:18:18,952 - INFO -         → Recursive search for child
2025-11-17 12:18:18,952 - INFO -         → Max recursion depth reached
2025-11-17 12:18:18,963 - INFO -       → Recursive search for child
2025-11-17 12:18:18,965 - INFO -       → Deep search (depth=2, unc=0.516)
2025-11-17 12:18:19,001 - INFO -         → Recursive search for child
2025-11-17 12:18:19,002 - INFO -         → Max recursion depth reached
2025-11-17 12:18:19,074 - INFO -         → Recursive search for child
2025-11-17 12:18:19,074 - INFO -         → Max recursion depth reached
2025-11-17 12:18:19,097 - INFO -         → Recursive search for child
2025-11-17 12:18:19,097 - INFO -         → Max recursion depth reached
2025-11-17 12:18:19,120 - INFO -         → Recursive search for child
2025-11-17 12:18:19,120 - INFO -         → Max recursion depth reached
2025-11-17 12:18:19,178 - INFO -     → Child cache hit: 60c3202aea42
2025-11-17 12:18:19,179 - INFO - Move 1: DataGo (Black) plays D16 [unc=0.180, DEEP, 3436ms]
2025-11-17 12:18:19,229 - INFO - Move 2: KataGo (White) thinking...
2025-11-17 12:18:19,272 - INFO - Move 2: KataGo (White) plays R3
2025-11-17 12:18:19,323 - INFO - Move 3: DataGo (Black) thinking...
2025-11-17 12:18:19,375 - INFO - Move 3: DataGo (Black) plays P3 [unc=0.053, 52ms]
2025-11-17 12:18:19,426 - INFO - Move 4: KataGo (White) thinking...
2025-11-17 12:18:19,538 - INFO - Move 4: KataGo (White) plays S5
2025-11-17 12:18:19,588 - INFO - Move 5: DataGo (Black) thinking...
2025-11-17 12:18:19,624 - INFO - Move 5: DataGo (Black) plays S6 [unc=0.043, 35ms]
2025-11-17 12:18:19,674 - INFO - Move 6: KataGo (White) thinking...
2025-11-17 12:18:19,816 - INFO - Move 6: KataGo (White) plays Q2
2025-11-17 12:18:19,867 - INFO - Move 7: DataGo (Black) thinking...
2025-11-17 12:18:19,899 - INFO - Move 7: DataGo (Black) plays S4 [unc=0.077, 32ms]
2025-11-17 12:18:19,950 - INFO - Move 8: KataGo (White) thinking...
2025-11-17 12:18:20,064 - INFO - Move 8: KataGo (White) plays P2
2025-11-17 12:18:20,114 - INFO - Move 9: DataGo (Black) thinking...
2025-11-17 12:18:20,139 - INFO - Move 9: DataGo (Black) plays PASS [unc=0.081, 25ms]
2025-11-17 12:18:20,190 - INFO - Move 10: KataGo (White) thinking...
2025-11-17 12:18:20,221 - INFO - Move 10: KataGo (White) plays N3
2025-11-17 12:18:20,271 - INFO - Move 11: DataGo (Black) thinking...
2025-11-17 12:18:20,317 - INFO - Move 11: DataGo (Black) plays R4 [unc=0.041, 46ms]
2025-11-17 12:18:20,367 - INFO - Move 12: KataGo (White) thinking...
2025-11-17 12:18:20,517 - INFO - Move 12: KataGo (White) plays S3
2025-11-17 12:18:20,567 - INFO - Move 13: DataGo (Black) thinking...
2025-11-17 12:18:20,589 - INFO - Move 13: DataGo (Black) plays O3 [unc=0.066, 21ms]
2025-11-17 12:18:20,639 - INFO - Move 14: KataGo (White) thinking...
2025-11-17 12:18:20,790 - INFO - Move 14: KataGo (White) plays O2
2025-11-17 12:18:20,840 - INFO - Move 15: DataGo (Black) thinking...
2025-11-17 12:18:20,858 - INFO - Move 15: DataGo (Black) plays PASS [unc=0.009, 17ms]
2025-11-17 12:18:20,908 - INFO - Move 16: KataGo (White) thinking...
2025-11-17 12:18:20,948 - INFO - Move 16: KataGo (White) plays C4
2025-11-17 12:18:20,998 - INFO - Move 17: DataGo (Black) thinking...
2025-11-17 12:18:21,031 - INFO - Move 17: DataGo (Black) plays N4 [unc=0.085, 33ms]
2025-11-17 12:18:21,082 - INFO - Move 18: KataGo (White) thinking...
2025-11-17 12:18:21,223 - INFO - Move 18: KataGo (White) plays C3
2025-11-17 12:18:21,273 - INFO - Move 19: DataGo (Black) thinking...
2025-11-17 12:18:21,291 - INFO - Move 19: DataGo (Black) plays C5 [unc=0.051, 17ms]
2025-11-17 12:18:21,341 - INFO - Move 20: KataGo (White) thinking...
2025-11-17 12:18:21,475 - INFO - Move 20: KataGo (White) plays D4
2025-11-17 12:18:21,525 - INFO - Move 21: DataGo (Black) thinking...
2025-11-17 12:18:21,538 - INFO - Move 21: DataGo (Black) plays E4 [unc=0.038, 13ms]
2025-11-17 12:18:21,589 - INFO - Move 22: KataGo (White) thinking...
2025-11-17 12:18:21,692 - INFO - Move 22: KataGo (White) plays D2
2025-11-17 12:18:21,742 - INFO - Move 23: DataGo (Black) thinking...
2025-11-17 12:18:21,765 - INFO - Move 23: DataGo (Black) plays E3 [unc=0.008, 23ms]
2025-11-17 12:18:21,815 - INFO - Move 24: KataGo (White) thinking...
2025-11-17 12:18:21,928 - INFO - Move 24: KataGo (White) plays B5
2025-11-17 12:18:21,978 - INFO - Move 25: DataGo (Black) thinking...
2025-11-17 12:18:22,013 - INFO - Move 25: DataGo (Black) plays B6 [unc=0.011, 35ms]
2025-11-17 12:18:22,063 - INFO - Move 26: KataGo (White) thinking...
2025-11-17 12:18:22,197 - INFO - Move 26: KataGo (White) plays E2
2025-11-17 12:18:22,247 - INFO - Move 27: DataGo (Black) thinking...
2025-11-17 12:18:22,264 - INFO - Move 27: DataGo (Black) plays F2 [unc=0.067, 18ms]
2025-11-17 12:18:22,315 - INFO - Move 28: KataGo (White) thinking...
2025-11-17 12:18:22,474 - INFO - Move 28: KataGo (White) plays A4
2025-11-17 12:18:22,525 - INFO - Move 29: DataGo (Black) thinking...
2025-11-17 12:18:22,548 - INFO - Move 29: DataGo (Black) plays PASS [unc=0.085, 23ms]
2025-11-17 12:18:22,598 - INFO - Move 30: KataGo (White) thinking...
2025-11-17 12:18:22,675 - INFO - Move 30: KataGo (White) plays M3
2025-11-17 12:18:22,726 - INFO - Move 31: DataGo (Black) thinking...
2025-11-17 12:18:22,776 - INFO - Move 31: DataGo (Black) plays M4 [unc=0.073, 50ms]
2025-11-17 12:18:22,826 - INFO - Move 32: KataGo (White) thinking...
2025-11-17 12:18:22,952 - INFO - Move 32: KataGo (White) plays F3
2025-11-17 12:18:23,002 - INFO - Move 33: DataGo (Black) thinking...
2025-11-17 12:18:23,029 - INFO - Move 33: DataGo (Black) plays F4 [unc=0.064, 27ms]
2025-11-17 12:18:23,080 - INFO - Move 34: KataGo (White) thinking...
2025-11-17 12:18:23,208 - INFO - Move 34: KataGo (White) plays G3
2025-11-17 12:18:23,258 - INFO - Move 35: DataGo (Black) thinking...
2025-11-17 12:18:23,274 - INFO - Move 35: DataGo (Black) plays G2 [unc=0.079, 16ms]
2025-11-17 12:18:23,324 - INFO - Move 36: KataGo (White) thinking...
2025-11-17 12:18:23,450 - INFO - Move 36: KataGo (White) plays C6
2025-11-17 12:18:23,500 - INFO - Move 37: DataGo (Black) thinking...
2025-11-17 12:18:23,513 - INFO - Move 37: DataGo (Black) plays E6 [unc=0.113, 13ms]
2025-11-17 12:18:23,563 - INFO - Move 38: KataGo (White) thinking...
2025-11-17 12:18:23,720 - INFO - Move 38: KataGo (White) plays C7
2025-11-17 12:18:23,770 - INFO - Move 39: DataGo (Black) thinking...
2025-11-17 12:18:23,791 - INFO - Move 39: DataGo (Black) plays C8 [unc=0.106, 20ms]
2025-11-17 12:18:23,841 - INFO - Move 40: KataGo (White) thinking...
2025-11-17 12:18:23,972 - INFO - Move 40: KataGo (White) plays B7
2025-11-17 12:18:24,023 - INFO - Move 41: DataGo (Black) thinking...
2025-11-17 12:18:24,036 - INFO - Move 41: DataGo (Black) plays E7 [unc=0.084, 14ms]
2025-11-17 12:18:24,087 - INFO - Move 42: KataGo (White) thinking...
2025-11-17 12:18:24,217 - INFO - Move 42: KataGo (White) plays D8
2025-11-17 12:18:24,267 - INFO - Move 43: DataGo (Black) thinking...
2025-11-17 12:18:24,310 - INFO - Move 43: DataGo (Black) plays C9 [unc=0.068, 42ms]
2025-11-17 12:18:24,360 - INFO - Move 44: KataGo (White) thinking...
2025-11-17 12:18:24,502 - INFO - Move 44: KataGo (White) plays Q15
2025-11-17 12:18:24,552 - INFO - Move 45: DataGo (Black) thinking...
2025-11-17 12:18:24,587 - INFO - Move 45: DataGo (Black) plays R15 [unc=0.039, 34ms]
2025-11-17 12:18:24,637 - INFO - Move 46: KataGo (White) thinking...
2025-11-17 12:18:24,770 - INFO - Move 46: KataGo (White) plays Q16
2025-11-17 12:18:24,821 - INFO - Move 47: DataGo (Black) thinking...
2025-11-17 12:18:24,843 - INFO - Move 47: DataGo (Black) plays Q17 [unc=0.032, 23ms]
2025-11-17 12:18:24,894 - INFO - Move 48: KataGo (White) thinking...
2025-11-17 12:18:25,014 - INFO - Move 48: KataGo (White) plays R14
2025-11-17 12:18:25,064 - INFO - Move 49: DataGo (Black) thinking...
2025-11-17 12:18:25,093 - INFO - Move 49: DataGo (Black) plays Q14 [unc=0.095, 29ms]
2025-11-17 12:18:25,144 - INFO - Move 50: KataGo (White) thinking...
2025-11-17 12:18:25,274 - INFO - Move 50: KataGo (White) plays P15
2025-11-17 12:18:25,325 - INFO - Move 51: DataGo (Black) thinking...
2025-11-17 12:18:25,335 - INFO - Move 51: DataGo (Black) plays P17 [unc=0.136, 10ms]
2025-11-17 12:18:25,385 - INFO - Move 52: KataGo (White) thinking...
2025-11-17 12:18:25,525 - INFO - Move 52: KataGo (White) plays R17
2025-11-17 12:18:25,575 - INFO - Move 53: DataGo (Black) thinking...
2025-11-17 12:18:25,603 - INFO - Move 53: DataGo (Black) plays S17 [unc=0.060, 28ms]
2025-11-17 12:18:25,653 - INFO - Move 54: KataGo (White) thinking...
2025-11-17 12:18:25,774 - INFO - Move 54: KataGo (White) plays O15
2025-11-17 12:18:25,824 - INFO - Move 55: DataGo (Black) thinking...
2025-11-17 12:18:25,847 - INFO - Move 55: DataGo (Black) plays S14 [unc=0.107, 22ms]
2025-11-17 12:18:25,897 - INFO - Move 56: KataGo (White) thinking...
2025-11-17 12:18:26,032 - INFO - Move 56: KataGo (White) plays M13
2025-11-17 12:18:26,082 - INFO - Move 57: DataGo (Black) thinking...
2025-11-17 12:18:26,148 - INFO -   → Complex position detected (unc=0.156)
2025-11-17 12:18:26,150 - INFO -   → No match found: 5ffe1a4b38c2, running deep search
2025-11-17 12:18:26,153 - INFO -   → Deep search (depth=0, unc=0.156)
2025-11-17 12:18:26,299 - INFO -     → Recursive search for child
2025-11-17 12:18:26,301 - INFO -     → Deep search (depth=1, unc=0.511)
2025-11-17 12:18:26,450 - INFO -       → Recursive search for child
2025-11-17 12:18:26,453 - INFO -       → Deep search (depth=2, unc=0.457)
2025-11-17 12:18:26,578 - INFO -         → Recursive search for child
2025-11-17 12:18:26,578 - INFO -         → Max recursion depth reached
2025-11-17 12:18:26,615 - INFO -         → Recursive search for child
2025-11-17 12:18:26,615 - INFO -         → Max recursion depth reached
2025-11-17 12:18:26,675 - INFO -         → Recursive search for child
2025-11-17 12:18:26,675 - INFO -         → Max recursion depth reached
2025-11-17 12:18:26,721 - INFO -         → Recursive search for child
2025-11-17 12:18:26,721 - INFO -         → Max recursion depth reached
2025-11-17 12:18:26,744 - INFO -       → Recursive search for child
2025-11-17 12:18:26,746 - INFO -       → Deep search (depth=2, unc=0.457)
2025-11-17 12:18:26,824 - INFO -         → Recursive search for child
2025-11-17 12:18:26,825 - INFO -         → Max recursion depth reached
2025-11-17 12:18:26,836 - INFO -         → Recursive search for child
2025-11-17 12:18:26,837 - INFO -         → Max recursion depth reached
2025-11-17 12:18:26,848 - INFO -         → Recursive search for child
2025-11-17 12:18:26,848 - INFO -         → Max recursion depth reached
2025-11-17 12:18:26,860 - INFO -         → Recursive search for child
2025-11-17 12:18:26,860 - INFO -         → Max recursion depth reached
2025-11-17 12:18:26,871 - INFO -       → Recursive search for child
2025-11-17 12:18:26,874 - INFO -       → Deep search (depth=2, unc=0.457)
2025-11-17 12:18:26,928 - INFO -         → Recursive search for child
2025-11-17 12:18:26,928 - INFO -         → Max recursion depth reached
2025-11-17 12:18:26,939 - INFO -         → Recursive search for child
2025-11-17 12:18:26,939 - INFO -         → Max recursion depth reached
2025-11-17 12:18:26,949 - INFO -         → Recursive search for child
2025-11-17 12:18:26,950 - INFO -         → Max recursion depth reached
2025-11-17 12:18:26,960 - INFO -         → Recursive search for child
2025-11-17 12:18:26,960 - INFO -         → Max recursion depth reached
2025-11-17 12:18:26,972 - INFO -       → Recursive search for child
2025-11-17 12:18:26,974 - INFO -       → Deep search (depth=2, unc=0.457)
2025-11-17 12:18:27,018 - INFO -         → Recursive search for child
2025-11-17 12:18:27,018 - INFO -         → Max recursion depth reached
2025-11-17 12:18:27,095 - INFO -         → Child cache hit: c247cb358d95
2025-11-17 12:18:27,098 - INFO -         → Recursive search for child
2025-11-17 12:18:27,098 - INFO -         → Max recursion depth reached
2025-11-17 12:18:27,163 - INFO -         → Recursive search for child
2025-11-17 12:18:27,163 - INFO -         → Max recursion depth reached
2025-11-17 12:18:27,215 - INFO -     → Recursive search for child
2025-11-17 12:18:27,217 - INFO -     → Deep search (depth=1, unc=0.511)
2025-11-17 12:18:27,315 - INFO -       → Recursive search for child
2025-11-17 12:18:27,318 - INFO -       → Deep search (depth=2, unc=0.438)
2025-11-17 12:18:27,356 - INFO -         → Recursive search for child
2025-11-17 12:18:27,357 - INFO -         → Max recursion depth reached
2025-11-17 12:18:27,368 - INFO -         → Recursive search for child
2025-11-17 12:18:27,368 - INFO -         → Max recursion depth reached
2025-11-17 12:18:27,377 - INFO -         → Recursive search for child
2025-11-17 12:18:27,377 - INFO -         → Max recursion depth reached
2025-11-17 12:18:27,387 - INFO -         → Recursive search for child
2025-11-17 12:18:27,388 - INFO -         → Max recursion depth reached
2025-11-17 12:18:27,399 - INFO -       → Recursive search for child
2025-11-17 12:18:27,401 - INFO -       → Deep search (depth=2, unc=0.438)
2025-11-17 12:18:27,446 - INFO -         → Child cache hit: 4b5f635fb3c9
2025-11-17 12:18:27,448 - INFO -         → Recursive search for child
2025-11-17 12:18:27,448 - INFO -         → Max recursion depth reached
2025-11-17 12:18:27,458 - INFO -         → Recursive search for child
2025-11-17 12:18:27,459 - INFO -         → Max recursion depth reached
2025-11-17 12:18:27,471 - INFO -         → Recursive search for child
2025-11-17 12:18:27,471 - INFO -         → Max recursion depth reached
2025-11-17 12:18:27,487 - INFO -       → Recursive search for child
2025-11-17 12:18:27,489 - INFO -       → Deep search (depth=2, unc=0.438)
2025-11-17 12:18:27,652 - INFO -         → Recursive search for child
2025-11-17 12:18:27,653 - INFO -         → Max recursion depth reached
2025-11-17 12:18:27,715 - INFO -         → Recursive search for child
2025-11-17 12:18:27,715 - INFO -         → Max recursion depth reached
2025-11-17 12:18:27,738 - INFO -         → Recursive search for child
2025-11-17 12:18:27,738 - INFO -         → Max recursion depth reached
2025-11-17 12:18:27,756 - INFO -         → Child cache hit: 6e46156c29ec
2025-11-17 12:18:27,758 - INFO -       → Recursive search for child
2025-11-17 12:18:27,761 - INFO -       → Deep search (depth=2, unc=0.438)
2025-11-17 12:18:27,843 - INFO -         → Recursive search for child
2025-11-17 12:18:27,843 - INFO -         → Max recursion depth reached
2025-11-17 12:18:27,853 - INFO -         → Recursive search for child
2025-11-17 12:18:27,854 - INFO -         → Max recursion depth reached
2025-11-17 12:18:27,864 - INFO -         → Recursive search for child
2025-11-17 12:18:27,864 - INFO -         → Max recursion depth reached
2025-11-17 12:18:27,908 - INFO -         → Child cache hit: c4fa73383c34
2025-11-17 12:18:27,911 - INFO -     → Recursive search for child
2025-11-17 12:18:27,913 - INFO -     → Deep search (depth=1, unc=0.511)
2025-11-17 12:18:28,042 - INFO -       → Recursive search for child
2025-11-17 12:18:28,045 - INFO -       → Deep search (depth=2, unc=0.409)
2025-11-17 12:18:28,087 - INFO -         → Recursive search for child
2025-11-17 12:18:28,087 - INFO -         → Max recursion depth reached
2025-11-17 12:18:28,100 - INFO -         → Recursive search for child
2025-11-17 12:18:28,100 - INFO -         → Max recursion depth reached
2025-11-17 12:18:28,111 - INFO -         → Recursive search for child
2025-11-17 12:18:28,111 - INFO -         → Max recursion depth reached
2025-11-17 12:18:28,125 - INFO -         → Recursive search for child
2025-11-17 12:18:28,125 - INFO -         → Max recursion depth reached
2025-11-17 12:18:28,171 - INFO -       → Recursive search for child
2025-11-17 12:18:28,173 - INFO -       → Deep search (depth=2, unc=0.409)
2025-11-17 12:18:28,287 - INFO -         → Recursive search for child
2025-11-17 12:18:28,287 - INFO -         → Max recursion depth reached
2025-11-17 12:18:28,327 - INFO -         → Child cache hit: 05fb74874ee2
2025-11-17 12:18:28,330 - INFO -         → Recursive search for child
2025-11-17 12:18:28,330 - INFO -         → Max recursion depth reached
2025-11-17 12:18:28,384 - INFO -         → Recursive search for child
2025-11-17 12:18:28,384 - INFO -         → Max recursion depth reached
2025-11-17 12:18:28,441 - INFO -       → Recursive search for child
2025-11-17 12:18:28,444 - INFO -       → Deep search (depth=2, unc=0.409)
2025-11-17 12:18:28,569 - INFO -         → Recursive search for child
2025-11-17 12:18:28,569 - INFO -         → Max recursion depth reached
2025-11-17 12:18:28,623 - INFO -         → Child cache hit: f45d52db9e1c
2025-11-17 12:18:28,625 - INFO -         → Recursive search for child
2025-11-17 12:18:28,626 - INFO -         → Max recursion depth reached
2025-11-17 12:18:28,646 - INFO -         → Recursive search for child
2025-11-17 12:18:28,646 - INFO -         → Max recursion depth reached
2025-11-17 12:18:28,665 - INFO -       → Recursive search for child
2025-11-17 12:18:28,668 - INFO -       → Deep search (depth=2, unc=0.409)
2025-11-17 12:18:28,751 - INFO -         → Recursive search for child
2025-11-17 12:18:28,751 - INFO -         → Max recursion depth reached
2025-11-17 12:18:28,807 - INFO -         → Recursive search for child
2025-11-17 12:18:28,807 - INFO -         → Max recursion depth reached
2025-11-17 12:18:28,829 - INFO -         → Recursive search for child
2025-11-17 12:18:28,829 - INFO -         → Max recursion depth reached
2025-11-17 12:18:28,846 - INFO -         → Recursive search for child
2025-11-17 12:18:28,846 - INFO -         → Max recursion depth reached
2025-11-17 12:18:28,860 - INFO -     → Recursive search for child
2025-11-17 12:18:28,862 - INFO -     → Deep search (depth=1, unc=0.511)
2025-11-17 12:18:28,922 - INFO -       → Recursive search for child
2025-11-17 12:18:28,925 - INFO -       → Deep search (depth=2, unc=0.457)
2025-11-17 12:18:29,058 - INFO -         → Recursive search for child
2025-11-17 12:18:29,059 - INFO -         → Max recursion depth reached
2025-11-17 12:18:29,114 - INFO -         → Recursive search for child
2025-11-17 12:18:29,115 - INFO -         → Max recursion depth reached
2025-11-17 12:18:29,169 - INFO -         → Recursive search for child
2025-11-17 12:18:29,169 - INFO -         → Max recursion depth reached
2025-11-17 12:18:29,229 - INFO -         → Recursive search for child
2025-11-17 12:18:29,229 - INFO -         → Max recursion depth reached
2025-11-17 12:18:29,254 - INFO -       → Recursive search for child
2025-11-17 12:18:29,257 - INFO -       → Deep search (depth=2, unc=0.457)
2025-11-17 12:18:29,328 - INFO -         → Recursive search for child
2025-11-17 12:18:29,328 - INFO -         → Max recursion depth reached
2025-11-17 12:18:29,380 - INFO -         → Recursive search for child
2025-11-17 12:18:29,380 - INFO -         → Max recursion depth reached
2025-11-17 12:18:29,399 - INFO -         → Recursive search for child
2025-11-17 12:18:29,399 - INFO -         → Max recursion depth reached
2025-11-17 12:18:29,414 - INFO -         → Recursive search for child
2025-11-17 12:18:29,414 - INFO -         → Max recursion depth reached
2025-11-17 12:18:29,427 - INFO -       → Recursive search for child
2025-11-17 12:18:29,430 - INFO -       → Deep search (depth=2, unc=0.457)
2025-11-17 12:18:29,519 - INFO -         → Recursive search for child
2025-11-17 12:18:29,519 - INFO -         → Max recursion depth reached
2025-11-17 12:18:29,572 - INFO -         → Recursive search for child
2025-11-17 12:18:29,573 - INFO -         → Max recursion depth reached
2025-11-17 12:18:29,629 - INFO -         → Recursive search for child
2025-11-17 12:18:29,629 - INFO -         → Max recursion depth reached
2025-11-17 12:18:29,683 - INFO -       → Recursive search for child
2025-11-17 12:18:29,685 - INFO -       → Deep search (depth=2, unc=0.457)
2025-11-17 12:18:29,790 - INFO -         → Recursive search for child
2025-11-17 12:18:29,790 - INFO -         → Max recursion depth reached
2025-11-17 12:18:29,834 - INFO -         → Recursive search for child
2025-11-17 12:18:29,834 - INFO -         → Max recursion depth reached
2025-11-17 12:18:29,854 - INFO -         → Recursive search for child
2025-11-17 12:18:29,854 - INFO -         → Max recursion depth reached
2025-11-17 12:18:29,871 - INFO -         → Recursive search for child
2025-11-17 12:18:29,871 - INFO -         → Max recursion depth reached
2025-11-17 12:18:29,886 - INFO - Move 57: DataGo (Black) plays J17 [unc=0.156, DEEP, 3802ms]
2025-11-17 12:18:29,936 - INFO - Move 58: KataGo (White) thinking...
2025-11-17 12:18:29,987 - INFO - Move 58: KataGo (White) plays C18
2025-11-17 12:18:30,037 - INFO - Move 59: DataGo (Black) thinking...
2025-11-17 12:18:30,041 - INFO - Move 59: DataGo (Black) plays PASS [unc=0.000, 4ms]
2025-11-17 12:18:30,091 - INFO - Move 60: KataGo (White) thinking...
2025-11-17 12:18:30,105 - INFO - Move 60: KataGo (White) plays E17
2025-11-17 12:18:30,155 - INFO - Move 61: DataGo (Black) thinking...
2025-11-17 12:18:30,204 - INFO - Move 61: DataGo (Black) plays E16 [unc=0.000, 48ms]
2025-11-17 12:18:30,254 - INFO - Move 62: KataGo (White) thinking...
2025-11-17 12:18:30,394 - INFO - Move 62: KataGo (White) plays B17
2025-11-17 12:18:30,444 - INFO - Move 63: DataGo (Black) thinking...
2025-11-17 12:18:30,448 - INFO - Move 63: DataGo (Black) plays F17 [unc=0.000, 4ms]
2025-11-17 12:18:30,498 - INFO - Move 64: KataGo (White) thinking...
2025-11-17 12:18:30,580 - INFO - Move 64: KataGo (White) plays E18
2025-11-17 12:18:30,631 - INFO - Move 65: DataGo (Black) thinking...
2025-11-17 12:18:30,635 - INFO - Move 65: DataGo (Black) plays PASS [unc=0.000, 4ms]
2025-11-17 12:18:30,685 - INFO - Move 66: KataGo (White) thinking...
2025-11-17 12:18:30,735 - INFO - Move 66: KataGo (White) plays G17
2025-11-17 12:18:30,786 - INFO - Move 67: DataGo (Black) thinking...
2025-11-17 12:18:30,835 - INFO - Move 67: DataGo (Black) plays F16 [unc=0.064, 49ms]
2025-11-17 12:18:30,885 - INFO - Move 68: KataGo (White) thinking...
2025-11-17 12:18:31,019 - INFO - Move 68: KataGo (White) plays F18
2025-11-17 12:18:31,069 - INFO - Move 69: DataGo (Black) thinking...
2025-11-17 12:18:31,074 - INFO - Move 69: DataGo (Black) plays PASS [unc=0.036, 4ms]
2025-11-17 12:18:31,124 - INFO - Move 70: KataGo (White) thinking...
2025-11-17 12:18:31,154 - INFO - Move 70: KataGo (White) plays B15
2025-11-17 12:18:31,204 - INFO - Move 71: DataGo (Black) thinking...
2025-11-17 12:18:31,207 - INFO - Move 71: DataGo (Black) plays PASS [unc=0.000, 3ms]
2025-11-17 12:18:31,257 - INFO - Move 72: KataGo (White) thinking...
2025-11-17 12:18:31,275 - INFO - Move 72: KataGo (White) plays G16
2025-11-17 12:18:31,325 - INFO - Move 73: DataGo (Black) thinking...
2025-11-17 12:18:31,357 - INFO - Move 73: DataGo (Black) plays PASS [unc=0.000, 32ms]
2025-11-17 12:18:31,407 - INFO - Move 74: KataGo (White) thinking...
2025-11-17 12:18:31,423 - INFO - Move 74: KataGo (White) plays G15
2025-11-17 12:18:31,474 - INFO - Move 75: DataGo (Black) thinking...
2025-11-17 12:18:31,491 - INFO - Move 75: DataGo (Black) plays PASS [unc=0.000, 17ms]
2025-11-17 12:18:31,541 - INFO - Move 76: KataGo (White) thinking...
2025-11-17 12:18:31,557 - INFO - Move 76: KataGo (White) plays G13
2025-11-17 12:18:31,607 - INFO - Move 77: DataGo (Black) thinking...
2025-11-17 12:18:31,672 - INFO - Move 77: DataGo (Black) plays H18 [unc=0.042, 65ms]
2025-11-17 12:18:31,723 - INFO - Move 78: KataGo (White) thinking...
2025-11-17 12:18:31,882 - INFO - Move 78: KataGo (White) plays J14
2025-11-17 12:18:31,933 - INFO - Move 79: DataGo (Black) thinking...
2025-11-17 12:18:31,936 - INFO - Move 79: DataGo (Black) plays J13 [unc=0.000, 4ms]
2025-11-17 12:18:31,987 - INFO - Move 80: KataGo (White) thinking...
2025-11-17 12:18:32,081 - INFO - Move 80: KataGo (White) plays H13
2025-11-17 12:18:32,131 - INFO - Move 81: DataGo (Black) thinking...
2025-11-17 12:18:32,146 - INFO - Move 81: DataGo (Black) plays G18 [unc=0.057, 14ms]
2025-11-17 12:18:32,196 - INFO - Move 82: KataGo (White) thinking...
2025-11-17 12:18:32,299 - INFO - Move 82: KataGo (White) plays D13
2025-11-17 12:18:32,349 - INFO - Move 83: DataGo (Black) thinking...
2025-11-17 12:18:32,354 - INFO - Move 83: DataGo (Black) plays E13 [unc=0.139, 5ms]
2025-11-17 12:18:32,404 - INFO - Move 84: KataGo (White) thinking...
2025-11-17 12:18:32,501 - INFO - Move 84: KataGo (White) plays E12
2025-11-17 12:18:32,552 - INFO - Move 85: DataGo (Black) thinking...
2025-11-17 12:18:32,557 - INFO - Move 85: DataGo (Black) plays F14 [unc=0.084, 5ms]
2025-11-17 12:18:32,607 - INFO - Move 86: KataGo (White) thinking...
2025-11-17 12:18:32,712 - INFO - Move 86: KataGo (White) plays C12
2025-11-17 12:18:32,762 - INFO - Move 87: DataGo (Black) thinking...
2025-11-17 12:18:32,767 - INFO - Move 87: DataGo (Black) plays G14 [unc=0.110, 4ms]
2025-11-17 12:18:32,817 - INFO - Move 88: KataGo (White) thinking...
2025-11-17 12:18:32,910 - INFO - Move 88: KataGo (White) plays H14
2025-11-17 12:18:32,960 - INFO - Move 89: DataGo (Black) thinking...
2025-11-17 12:18:32,965 - INFO - Move 89: DataGo (Black) plays H15 [unc=0.115, 4ms]
2025-11-17 12:18:33,015 - INFO - Move 90: KataGo (White) thinking...
2025-11-17 12:18:33,107 - INFO - Move 90: KataGo (White) plays F13
2025-11-17 12:18:33,157 - INFO - Move 91: DataGo (Black) thinking...
2025-11-17 12:18:33,161 - INFO - Move 91: DataGo (Black) plays E14 [unc=0.028, 4ms]
2025-11-17 12:18:33,212 - INFO - Move 92: KataGo (White) thinking...
2025-11-17 12:18:33,308 - INFO - Move 92: KataGo (White) plays J12
2025-11-17 12:18:33,358 - INFO - Move 93: DataGo (Black) thinking...
2025-11-17 12:18:33,362 - INFO - Move 93: DataGo (Black) plays B16 [unc=0.030, 4ms]
2025-11-17 12:18:33,413 - INFO - Move 94: KataGo (White) thinking...
2025-11-17 12:18:33,528 - INFO - Move 94: KataGo (White) plays A16
2025-11-17 12:18:33,578 - INFO - Move 95: DataGo (Black) thinking...
2025-11-17 12:18:33,583 - INFO - Move 95: DataGo (Black) plays C15 [unc=0.109, 4ms]
2025-11-17 12:18:33,633 - INFO - Move 96: KataGo (White) thinking...
2025-11-17 12:18:33,742 - INFO - Move 96: KataGo (White) plays B14
2025-11-17 12:18:33,792 - INFO - Move 97: DataGo (Black) thinking...
2025-11-17 12:18:33,797 - INFO - Move 97: DataGo (Black) plays K12 [unc=0.061, 4ms]
2025-11-17 12:18:33,847 - INFO - Move 98: KataGo (White) thinking...
2025-11-17 12:18:33,937 - INFO - Move 98: KataGo (White) plays L16
2025-11-17 12:18:33,988 - INFO - Move 99: DataGo (Black) thinking...
2025-11-17 12:18:34,014 - INFO - Move 99: DataGo (Black) plays D14 [unc=0.114, 26ms]
2025-11-17 12:18:34,064 - INFO - Move 100: KataGo (White) thinking...
2025-11-17 12:18:34,188 - INFO - Move 100: KataGo (White) plays J11
2025-11-17 12:18:34,239 - INFO - Move 101: DataGo (Black) thinking...
2025-11-17 12:18:34,243 - INFO - Move 101: DataGo (Black) plays K11 [unc=0.014, 4ms]
2025-11-17 12:18:34,293 - INFO - Move 102: KataGo (White) thinking...
2025-11-17 12:18:34,376 - INFO - Move 102: KataGo (White) plays J15
2025-11-17 12:18:34,426 - INFO - Move 103: DataGo (Black) thinking...
2025-11-17 12:18:34,441 - INFO - Move 103: DataGo (Black) plays F12 [unc=0.132, 15ms]
2025-11-17 12:18:34,491 - INFO - Move 104: KataGo (White) thinking...
2025-11-17 12:18:34,624 - INFO - Move 104: KataGo (White) plays F11
2025-11-17 12:18:34,674 - INFO - Move 105: DataGo (Black) thinking...
2025-11-17 12:18:34,679 - INFO - Move 105: DataGo (Black) plays H16 [unc=0.146, 5ms]
2025-11-17 12:18:34,730 - INFO - Move 106: KataGo (White) thinking...
2025-11-17 12:18:34,828 - INFO - Move 106: KataGo (White) plays K10
2025-11-17 12:18:34,878 - INFO - Move 107: DataGo (Black) thinking...
2025-11-17 12:18:34,901 - INFO - Move 107: DataGo (Black) plays L15 [unc=0.145, 23ms]
2025-11-17 12:18:34,951 - INFO - Move 108: KataGo (White) thinking...
2025-11-17 12:18:35,073 - INFO - Move 108: KataGo (White) plays H10
2025-11-17 12:18:35,123 - INFO - Move 109: DataGo (Black) thinking...
2025-11-17 12:18:35,127 - INFO - Move 109: DataGo (Black) plays J9 [unc=0.000, 4ms]
2025-11-17 12:18:35,178 - INFO - Move 110: KataGo (White) thinking...
2025-11-17 12:18:35,238 - INFO - Move 110: KataGo (White) plays L14
2025-11-17 12:18:35,289 - INFO - Move 111: DataGo (Black) thinking...
2025-11-17 12:18:35,294 - INFO - Move 111: DataGo (Black) plays E11 [unc=0.139, 5ms]
2025-11-17 12:18:35,344 - INFO - Move 112: KataGo (White) thinking...
2025-11-17 12:18:35,466 - INFO - Move 112: KataGo (White) plays G12
2025-11-17 12:18:35,516 - INFO - Move 113: DataGo (Black) thinking...
2025-11-17 12:18:35,530 - INFO - Move 113: DataGo (Black) plays M11 [unc=0.100, 13ms]
2025-11-17 12:18:35,580 - INFO - Move 114: KataGo (White) thinking...
2025-11-17 12:18:35,731 - INFO - Move 114: KataGo (White) plays K15
2025-11-17 12:18:35,781 - INFO - Move 115: DataGo (Black) thinking...
2025-11-17 12:18:35,794 - INFO - Move 115: DataGo (Black) plays C13 [unc=0.046, 13ms]
2025-11-17 12:18:35,845 - INFO - Move 116: KataGo (White) thinking...
2025-11-17 12:18:35,980 - INFO - Move 116: KataGo (White) plays D12
2025-11-17 12:18:36,031 - INFO - Move 117: DataGo (Black) thinking...
2025-11-17 12:18:36,035 - INFO - Move 117: DataGo (Black) plays B13 [unc=0.068, 4ms]
2025-11-17 12:18:36,085 - INFO - Move 118: KataGo (White) thinking...
2025-11-17 12:18:36,176 - INFO - Move 118: KataGo (White) plays H11
2025-11-17 12:18:36,226 - INFO - Move 119: DataGo (Black) thinking...
2025-11-17 12:18:36,259 - INFO - Move 119: DataGo (Black) plays G10 [unc=0.108, 33ms]
2025-11-17 12:18:36,310 - INFO - Move 120: KataGo (White) thinking...
2025-11-17 12:18:36,416 - INFO - Move 120: KataGo (White) plays A15
2025-11-17 12:18:36,467 - INFO - Move 121: DataGo (Black) thinking...
2025-11-17 12:18:36,471 - INFO - Move 121: DataGo (Black) plays C14 [unc=0.076, 4ms]
2025-11-17 12:18:36,521 - INFO - Move 122: KataGo (White) thinking...
2025-11-17 12:18:36,623 - INFO - Move 122: KataGo (White) plays H9
2025-11-17 12:18:36,673 - INFO - Move 123: DataGo (Black) thinking...
2025-11-17 12:18:36,714 - INFO -   → Complex position detected (unc=0.160)
2025-11-17 12:18:36,717 - INFO -   → No match found: 77b98e78984f, running deep search
2025-11-17 12:18:36,719 - INFO -   → Deep search (depth=0, unc=0.160)
2025-11-17 12:18:36,863 - INFO -     → Recursive search for child
2025-11-17 12:18:36,866 - INFO -     → Deep search (depth=1, unc=0.607)
2025-11-17 12:18:36,976 - INFO -       → Recursive search for child
2025-11-17 12:18:36,978 - INFO -       → Deep search (depth=2, unc=0.542)
2025-11-17 12:18:37,105 - INFO -         → Recursive search for child
2025-11-17 12:18:37,105 - INFO -         → Max recursion depth reached
2025-11-17 12:18:37,143 - INFO -         → Recursive search for child
2025-11-17 12:18:37,143 - INFO -         → Max recursion depth reached
2025-11-17 12:18:37,197 - INFO -         → Recursive search for child
2025-11-17 12:18:37,197 - INFO -         → Max recursion depth reached
2025-11-17 12:18:37,245 - INFO -         → Recursive search for child
2025-11-17 12:18:37,246 - INFO -         → Max recursion depth reached
2025-11-17 12:18:37,263 - INFO -       → Recursive search for child
2025-11-17 12:18:37,265 - INFO -       → Deep search (depth=2, unc=0.542)
2025-11-17 12:18:37,340 - INFO -         → Recursive search for child
2025-11-17 12:18:37,340 - INFO -         → Max recursion depth reached
2025-11-17 12:18:37,349 - INFO -         → Recursive search for child
2025-11-17 12:18:37,349 - INFO -         → Max recursion depth reached
2025-11-17 12:18:37,360 - INFO -         → Recursive search for child
2025-11-17 12:18:37,360 - INFO -         → Max recursion depth reached
2025-11-17 12:18:37,369 - INFO -         → Recursive search for child
2025-11-17 12:18:37,369 - INFO -         → Max recursion depth reached
2025-11-17 12:18:37,378 - INFO -       → Recursive search for child
2025-11-17 12:18:37,381 - INFO -       → Deep search (depth=2, unc=0.542)
2025-11-17 12:18:37,410 - INFO -         → Recursive search for child
2025-11-17 12:18:37,410 - INFO -         → Max recursion depth reached
2025-11-17 12:18:37,420 - INFO -         → Recursive search for child
2025-11-17 12:18:37,420 - INFO -         → Max recursion depth reached
2025-11-17 12:18:37,429 - INFO -         → Recursive search for child
2025-11-17 12:18:37,429 - INFO -         → Max recursion depth reached
2025-11-17 12:18:37,438 - INFO -         → Recursive search for child
2025-11-17 12:18:37,438 - INFO -         → Max recursion depth reached
2025-11-17 12:18:37,447 - INFO -       → Recursive search for child
2025-11-17 12:18:37,450 - INFO -       → Deep search (depth=2, unc=0.542)
2025-11-17 12:18:37,474 - INFO -         → Recursive search for child
2025-11-17 12:18:37,474 - INFO -         → Max recursion depth reached
2025-11-17 12:18:37,483 - INFO -         → Recursive search for child
2025-11-17 12:18:37,483 - INFO -         → Max recursion depth reached
2025-11-17 12:18:37,494 - INFO -         → Recursive search for child
2025-11-17 12:18:37,494 - INFO -         → Max recursion depth reached
2025-11-17 12:18:37,503 - INFO -     → Recursive search for child
2025-11-17 12:18:37,506 - INFO -     → Deep search (depth=1, unc=0.607)
2025-11-17 12:18:37,533 - INFO -       → Recursive search for child
2025-11-17 12:18:37,536 - INFO -       → Deep search (depth=2, unc=0.478)
2025-11-17 12:18:37,556 - INFO -         → Recursive search for child
2025-11-17 12:18:37,557 - INFO -         → Max recursion depth reached
2025-11-17 12:18:37,567 - INFO -         → Recursive search for child
2025-11-17 12:18:37,567 - INFO -         → Max recursion depth reached
2025-11-17 12:18:37,577 - INFO -         → Recursive search for child
2025-11-17 12:18:37,577 - INFO -         → Max recursion depth reached
2025-11-17 12:18:37,587 - INFO -         → Recursive search for child
2025-11-17 12:18:37,587 - INFO -         → Max recursion depth reached
2025-11-17 12:18:37,596 - INFO -       → Recursive search for child
2025-11-17 12:18:37,599 - INFO -       → Deep search (depth=2, unc=0.478)
2025-11-17 12:18:37,623 - INFO -         → Child cache hit: 52dcb346cd0d
2025-11-17 12:18:37,626 - INFO -         → Recursive search for child
2025-11-17 12:18:37,626 - INFO -         → Max recursion depth reached
2025-11-17 12:18:37,636 - INFO -         → Recursive search for child
2025-11-17 12:18:37,636 - INFO -         → Max recursion depth reached
2025-11-17 12:18:37,647 - INFO -         → Recursive search for child
2025-11-17 12:18:37,647 - INFO -         → Max recursion depth reached
2025-11-17 12:18:37,657 - INFO -       → Recursive search for child
2025-11-17 12:18:37,660 - INFO -       → Deep search (depth=2, unc=0.478)
2025-11-17 12:18:37,683 - INFO -         → Child cache hit: c21783f577d6
2025-11-17 12:18:37,686 - INFO -         → Child cache hit: 8a1fefe198aa
2025-11-17 12:18:37,688 - INFO -         → Recursive search for child
2025-11-17 12:18:37,688 - INFO -         → Max recursion depth reached
2025-11-17 12:18:37,699 - INFO -         → Recursive search for child
2025-11-17 12:18:37,699 - INFO -         → Max recursion depth reached
2025-11-17 12:18:37,709 - INFO -       → Recursive search for child
2025-11-17 12:18:37,712 - INFO -       → Deep search (depth=2, unc=0.478)
2025-11-17 12:18:37,733 - INFO -         → Child cache hit: 3de107336869
2025-11-17 12:18:37,736 - INFO -         → Child cache hit: ad029f07c018
2025-11-17 12:18:37,738 - INFO -         → Child cache hit: d80a8e189985
2025-11-17 12:18:37,740 - INFO -         → Recursive search for child
2025-11-17 12:18:37,740 - INFO -         → Max recursion depth reached
2025-11-17 12:18:37,750 - INFO -     → Recursive search for child
2025-11-17 12:18:37,753 - INFO -     → Deep search (depth=1, unc=0.607)
2025-11-17 12:18:37,774 - INFO -       → Recursive search for child
2025-11-17 12:18:37,776 - INFO -       → Deep search (depth=2, unc=0.476)
2025-11-17 12:18:37,798 - INFO -         → Recursive search for child
2025-11-17 12:18:37,798 - INFO -         → Max recursion depth reached
2025-11-17 12:18:37,809 - INFO -         → Recursive search for child
2025-11-17 12:18:37,809 - INFO -         → Max recursion depth reached
2025-11-17 12:18:37,819 - INFO -         → Recursive search for child
2025-11-17 12:18:37,819 - INFO -         → Max recursion depth reached
2025-11-17 12:18:37,830 - INFO -       → Child cache hit: c8055c928d55
2025-11-17 12:18:37,832 - INFO -       → Child cache hit: 177cf0df97ad
2025-11-17 12:18:37,835 - INFO -       → Recursive search for child
2025-11-17 12:18:37,837 - INFO -       → Deep search (depth=2, unc=0.476)
2025-11-17 12:18:37,856 - INFO -         → Recursive search for child
2025-11-17 12:18:37,857 - INFO -         → Max recursion depth reached
2025-11-17 12:18:37,866 - INFO -         → Recursive search for child
2025-11-17 12:18:37,867 - INFO -         → Max recursion depth reached
2025-11-17 12:18:37,877 - INFO -         → Recursive search for child
2025-11-17 12:18:37,877 - INFO -         → Max recursion depth reached
2025-11-17 12:18:37,886 - INFO -     → Recursive search for child
2025-11-17 12:18:37,889 - INFO -     → Deep search (depth=1, unc=0.607)
2025-11-17 12:18:37,913 - INFO -       → Recursive search for child
2025-11-17 12:18:37,915 - INFO -       → Deep search (depth=2, unc=0.472)
2025-11-17 12:18:37,937 - INFO -         → Recursive search for child
2025-11-17 12:18:37,937 - INFO -         → Max recursion depth reached
2025-11-17 12:18:37,950 - INFO -         → Recursive search for child
2025-11-17 12:18:37,950 - INFO -         → Max recursion depth reached
2025-11-17 12:18:37,961 - INFO -         → Recursive search for child
2025-11-17 12:18:37,961 - INFO -         → Max recursion depth reached
2025-11-17 12:18:37,972 - INFO -         → Recursive search for child
2025-11-17 12:18:37,972 - INFO -         → Max recursion depth reached
2025-11-17 12:18:37,982 - INFO -       → Recursive search for child
2025-11-17 12:18:37,984 - INFO -       → Deep search (depth=2, unc=0.472)
2025-11-17 12:18:38,006 - INFO -         → Child cache hit: 369e4b6db548
2025-11-17 12:18:38,009 - INFO -         → Recursive search for child
2025-11-17 12:18:38,009 - INFO -         → Max recursion depth reached
2025-11-17 12:18:38,019 - INFO -         → Recursive search for child
2025-11-17 12:18:38,019 - INFO -         → Max recursion depth reached
2025-11-17 12:18:38,029 - INFO -         → Recursive search for child
2025-11-17 12:18:38,029 - INFO -         → Max recursion depth reached
2025-11-17 12:18:38,039 - INFO -       → Recursive search for child
2025-11-17 12:18:38,041 - INFO -       → Deep search (depth=2, unc=0.472)
2025-11-17 12:18:38,062 - INFO -         → Child cache hit: e4659b302344
2025-11-17 12:18:38,065 - INFO -         → Child cache hit: 3472acdc4efc
2025-11-17 12:18:38,067 - INFO -         → Recursive search for child
2025-11-17 12:18:38,067 - INFO -         → Max recursion depth reached
2025-11-17 12:18:38,078 - INFO -         → Recursive search for child
2025-11-17 12:18:38,078 - INFO -         → Max recursion depth reached
2025-11-17 12:18:38,088 - INFO -       → Recursive search for child
2025-11-17 12:18:38,090 - INFO -       → Deep search (depth=2, unc=0.472)
2025-11-17 12:18:38,111 - INFO -         → Child cache hit: 87eaa02adfb9
2025-11-17 12:18:38,114 - INFO -         → Child cache hit: 0d0f951ed3f1
2025-11-17 12:18:38,116 - INFO -         → Child cache hit: 8b130fdb045e
2025-11-17 12:18:38,118 - INFO -         → Recursive search for child
2025-11-17 12:18:38,118 - INFO -         → Max recursion depth reached
2025-11-17 12:18:38,128 - INFO - Move 123: DataGo (Black) plays L10 [unc=0.160, DEEP, 1453ms]
2025-11-17 12:18:38,178 - INFO - Move 124: KataGo (White) thinking...
2025-11-17 12:18:38,224 - INFO - Move 124: KataGo (White) plays B19
2025-11-17 12:18:38,275 - INFO - Move 125: DataGo (Black) thinking...
2025-11-17 12:18:38,319 - INFO - Move 125: DataGo (Black) plays D18 [unc=0.077, 45ms]
2025-11-17 12:18:38,370 - INFO - Move 126: KataGo (White) thinking...
2025-11-17 12:18:38,525 - INFO - Move 126: KataGo (White) plays D17
2025-11-17 12:18:38,575 - INFO - Move 127: DataGo (Black) thinking...
2025-11-17 12:18:38,580 - INFO - Move 127: DataGo (Black) plays D19 [unc=0.067, 4ms]
2025-11-17 12:18:38,630 - INFO - Move 128: KataGo (White) thinking...
2025-11-17 12:18:38,744 - INFO - Move 128: KataGo (White) plays C19
2025-11-17 12:18:38,794 - INFO - Move 129: DataGo (Black) thinking...
2025-11-17 12:18:38,798 - INFO - Move 129: DataGo (Black) plays C17 [unc=0.015, 4ms]
2025-11-17 12:18:38,848 - INFO - Move 130: KataGo (White) thinking...
2025-11-17 12:18:38,953 - INFO - Move 130: KataGo (White) plays E19
2025-11-17 12:18:39,004 - INFO - Move 131: DataGo (Black) thinking...
2025-11-17 12:18:39,008 - INFO - Move 131: DataGo (Black) plays A18 [unc=0.057, 4ms]
2025-11-17 12:18:39,059 - INFO - Move 132: KataGo (White) thinking...
2025-11-17 12:18:39,152 - INFO - Move 132: KataGo (White) plays A17
2025-11-17 12:18:39,203 - INFO - Move 133: DataGo (Black) thinking...
2025-11-17 12:18:39,206 - INFO - Move 133: DataGo (Black) plays PASS [unc=0.000, 3ms]
2025-11-17 12:18:39,256 - INFO - Move 134: KataGo (White) thinking...
2025-11-17 12:18:39,297 - INFO - Move 134: KataGo (White) plays K16
2025-11-17 12:18:39,347 - INFO - Move 135: DataGo (Black) thinking...
2025-11-17 12:18:39,367 - INFO - Move 135: DataGo (Black) plays H8 [unc=0.122, 20ms]
2025-11-17 12:18:39,417 - INFO - Move 136: KataGo (White) thinking...
2025-11-17 12:18:39,545 - INFO - Move 136: KataGo (White) plays G19
2025-11-17 12:18:39,595 - INFO - Move 137: DataGo (Black) thinking...
2025-11-17 12:18:39,615 - INFO - Move 137: DataGo (Black) plays PASS [unc=0.000, 20ms]
2025-11-17 12:18:39,665 - INFO - Move 138: KataGo (White) thinking...
2025-11-17 12:18:39,705 - INFO - Move 138: KataGo (White) plays K18
2025-11-17 12:18:39,755 - INFO - Move 139: DataGo (Black) thinking...
2025-11-17 12:18:39,774 - INFO - Move 139: DataGo (Black) plays F15 [unc=0.148, 18ms]
2025-11-17 12:18:39,824 - INFO - Move 140: KataGo (White) thinking...
2025-11-17 12:18:39,962 - INFO - Move 140: KataGo (White) plays H19
2025-11-17 12:18:40,012 - INFO - Move 141: DataGo (Black) thinking...
2025-11-17 12:18:40,016 - INFO - Move 141: DataGo (Black) plays J19 [unc=0.022, 4ms]
2025-11-17 12:18:40,066 - INFO - Move 142: KataGo (White) thinking...
2025-11-17 12:18:40,162 - INFO - Move 142: KataGo (White) plays J8
2025-11-17 12:18:40,213 - INFO - Move 143: DataGo (Black) thinking...
2025-11-17 12:18:40,251 - INFO - Move 143: DataGo (Black) plays K8 [unc=0.083, 39ms]
2025-11-17 12:18:40,302 - INFO - Move 144: KataGo (White) thinking...
2025-11-17 12:18:40,423 - INFO - Move 144: KataGo (White) plays K9
2025-11-17 12:18:40,473 - INFO - Move 145: DataGo (Black) thinking...
2025-11-17 12:18:40,477 - INFO - Move 145: DataGo (Black) plays L9 [unc=0.063, 4ms]
2025-11-17 12:18:40,528 - INFO - Move 146: KataGo (White) thinking...
2025-11-17 12:18:40,620 - INFO - Move 146: KataGo (White) plays B18
2025-11-17 12:18:40,670 - INFO - Move 147: DataGo (Black) thinking...
2025-11-17 12:18:40,690 - INFO - Move 147: DataGo (Black) plays PASS [unc=0.000, 19ms]
2025-11-17 12:18:40,740 - INFO - Move 148: KataGo (White) thinking...
2025-11-17 12:18:40,779 - INFO - Move 148: KataGo (White) plays J18
2025-11-17 12:18:40,830 - INFO - Move 149: DataGo (Black) thinking...
2025-11-17 12:18:40,862 - INFO - Move 149: DataGo (Black) plays F19 [unc=0.054, 32ms]
2025-11-17 12:18:40,912 - INFO - Move 150: KataGo (White) thinking...
2025-11-17 12:18:41,021 - INFO - Move 150: KataGo (White) plays B11
2025-11-17 12:18:41,072 - INFO - Move 151: DataGo (Black) thinking...
2025-11-17 12:18:41,089 - INFO - Move 151: DataGo (Black) plays H17 [unc=0.096, 17ms]
2025-11-17 12:18:41,139 - INFO - Move 152: KataGo (White) thinking...
2025-11-17 12:18:41,253 - INFO - Move 152: KataGo (White) plays C11
2025-11-17 12:18:41,304 - INFO - Move 153: DataGo (Black) thinking...
2025-11-17 12:18:41,308 - INFO - Move 153: DataGo (Black) plays K17 [unc=0.039, 4ms]
2025-11-17 12:18:41,358 - INFO - Move 154: KataGo (White) thinking...
2025-11-17 12:18:41,483 - INFO - Move 154: KataGo (White) plays G19
2025-11-17 12:18:41,533 - INFO - Move 155: DataGo (Black) thinking...
2025-11-17 12:18:41,537 - INFO - Move 155: DataGo (Black) plays H19 [unc=0.043, 4ms]
2025-11-17 12:18:41,587 - INFO - Move 156: KataGo (White) thinking...
2025-11-17 12:18:41,711 - INFO - Move 156: KataGo (White) plays L17
2025-11-17 12:18:41,762 - INFO - Move 157: DataGo (Black) thinking...
2025-11-17 12:18:41,766 - INFO - Move 157: DataGo (Black) plays L18 [unc=0.112, 4ms]
2025-11-17 12:18:41,817 - INFO - Move 158: KataGo (White) thinking...
2025-11-17 12:18:41,945 - INFO - Move 158: KataGo (White) plays M18
2025-11-17 12:18:41,996 - INFO - Move 159: DataGo (Black) thinking...
2025-11-17 12:18:42,000 - INFO - Move 159: DataGo (Black) plays K19 [unc=0.113, 4ms]
2025-11-17 12:18:42,050 - INFO - Move 160: KataGo (White) thinking...
2025-11-17 12:18:42,155 - INFO - Move 160: KataGo (White) plays K18
2025-11-17 12:18:42,205 - INFO - Move 161: DataGo (Black) thinking...
2025-11-17 12:18:42,220 - INFO - Move 161: DataGo (Black) plays L19 [unc=0.103, 14ms]
2025-11-17 12:18:42,270 - INFO - Move 162: KataGo (White) thinking...
2025-11-17 12:18:42,380 - INFO - Move 162: KataGo (White) plays PASS
2025-11-17 12:18:42,430 - INFO - Move 163: DataGo (Black) thinking...
2025-11-17 12:18:42,440 - INFO - Move 163: DataGo (Black) plays PASS [unc=0.124, 10ms]
2025-11-17 12:18:42,440 - INFO - 
Both players passed. Scoring final board...
2025-11-17 12:18:42,672 - INFO - Final score: B+285.5
2025-11-17 12:18:42,672 - INFO - DataGo (Black) wins by scoring!
2025-11-17 12:18:42,672 - INFO - 
Game 1 Statistics:
2025-11-17 12:18:42,672 - INFO -   Moves played: 82
2025-11-17 12:18:42,672 - INFO -   RAG queries: 3
2025-11-17 12:18:42,672 - INFO -   RAG hits: 27
2025-11-17 12:18:42,672 - INFO -   Exact matches: 27
2025-11-17 12:18:42,672 - INFO -   Deep searches: 49
2025-11-17 12:18:42,672 - INFO -   Recursive searches: 46
2025-11-17 12:18:42,673 - INFO -   Unique positions: 152
2025-11-17 12:18:42,673 - INFO -   Total contexts: 172
2025-11-17 12:18:42,673 - INFO -   Average uncertainty: 0.068
2025-11-17 12:18:42,673 - INFO - 
Cleaning up...
2025-11-17 12:18:43,740 - INFO - 
======================================================================
2025-11-17 12:18:43,740 - INFO - Overall Match Statistics
2025-11-17 12:18:43,740 - INFO - ======================================================================
2025-11-17 12:18:43,740 - INFO - Total moves: 82
2025-11-17 12:18:43,740 - INFO - Total RAG queries: 3
2025-11-17 12:18:43,740 - INFO - Total exact matches: 27
2025-11-17 12:18:43,740 - INFO - Total deep searches: 49
2025-11-17 12:18:43,740 - INFO - Total recursive searches: 46
2025-11-17 12:18:43,740 - INFO - Unique positions stored: 152
2025-11-17 12:18:43,740 - INFO - Total contexts: 172
2025-11-17 12:18:43,740 - INFO - Avg contexts per position: 1.1
2025-11-17 12:18:43,740 - INFO - 
======================================================================
2025-11-17 12:18:43,740 - INFO - Match Results
2025-11-17 12:18:43,740 - INFO - ======================================================================
2025-11-17 12:18:43,740 - INFO - Game 1: DataGo
2025-11-17 12:18:43,740 - INFO - 
2025-11-17 12:18:43,740 - INFO - DataGo: 1 wins
2025-11-17 12:18:43,740 - INFO - KataGo: 0 wins
2025-11-17 12:18:43,740 - INFO - Draws: 0
2025-11-17 12:18:43,740 - INFO - ======================================================================
